{
  "$id": "https://commandlayer.org/schemas/v1.0.0/commons/classify/requests/classify.request.schema.json",
  "$schema": "https://json-schema.org/draft/2020-12/schema",
  "title": "classify.request",
  "description": "Request to classify content against a taxonomy using ML/rules/keywords. Non-deterministic by default; providers must disclose provenance in receipts.",
  "type": "object",
  "additionalProperties": false,

  "properties": {
    "x402": {
      "description": "x402 envelope describing the verb, version, and optional routing metadata.",
      "allOf": [
        {
          "$ref": "https://commandlayer.org/schemas/v1.0.0/_shared/x402.schema.json"
        },
        {
          "type": "object",
          "properties": {
            "verb": { "const": "classify" },
            "version": { "const": "1.0.0" }
          },
          "required": ["verb", "version"]
        }
      ]
    },

    "actor": {
      "description": "Logical caller identifier (e.g., ENS name, DID, or internal principal).",
      "type": "string",
      "minLength": 1,
      "maxLength": 256
    },

    "limits": {
      "description": "Optional execution limits and constraints for this classification.",
      "type": "object",
      "additionalProperties": false,
      "properties": {
        "max_labels": {
          "description": "Maximum number of labels to return.",
          "type": "integer",
          "minimum": 1,
          "maximum": 128
        },
        "max_tokens": {
          "description": "Optional max tokens for model-based classification.",
          "type": "integer",
          "minimum": 1
        },
        "timeout_ms": {
          "description": "Hard timeout for this operation in milliseconds.",
          "type": "integer",
          "minimum": 1
        }
      }
    },

    "channel": {
      "description": "Channel capabilities and modalities for this call.",
      "type": "object",
      "additionalProperties": false,
      "properties": {
        "protocol": {
          "description": "Logical protocol (e.g., https, wss, xrpc).",
          "type": "string",
          "minLength": 1,
          "maxLength": 32
        },
        "input_modalities": {
          "description": "Modalities accepted for input.",
          "type": "array",
          "items": {
            "type": "string",
            "minLength": 1,
            "maxLength": 64
          },
          "minItems": 1,
          "maxItems": 8
        },
        "output_modalities": {
          "description": "Modalities produced as output.",
          "type": "array",
          "items": {
            "type": "string",
            "minLength": 1,
            "maxLength": 64
          },
          "minItems": 1,
          "maxItems": 8
        }
      },
      "required": ["protocol", "input_modalities", "output_modalities"]
    },

    "input": {
      "description": "Content to classify and optional taxonomy hints.",
      "type": "object",
      "additionalProperties": false,
      "properties": {
        "content": {
          "description": "Raw text or serialized content to classify.",
          "type": "string",
          "minLength": 1
        },
        "taxonomy": {
          "description": "Optional list of candidate labels or a taxonomy path.",
          "type": "array",
          "items": {
            "type": "string",
            "minLength": 1,
            "maxLength": 128
          },
          "maxItems": 128
        }
      },
      "required": ["content"]
    }
  },

  "required": ["x402", "actor", "limits", "channel", "input"]
}
